{
  "pass": "B",
  "mode": "key_blind",
  "sample_seed": "s2",
  "pre_read": {
    "material_issues": [
      {
        "issue": "The Redis fast-path key idem:resp:{idempotency_key} has no merchant scope and no request-hash check. This contradicts P3 and FR-5 and causes cross-tenant collisions, because order IDs are accepted as keys.",
        "location": "p.8 §9.2; p.4 §3 P3; p.7 §9.1",
        "covered_by_review": "full"
      },
      {
        "issue": "The Fraud Hook detokenises the PAN using the Card Adapter's role and sends it to FRV-1, yet the §12.2 scope table lists the Fraud Hook as out of CDE scope. This contradicts P2 and NFR-5.",
        "location": "p.11 §13.1; p.10 §12.1-12.2",
        "covered_by_review": "full"
      },
      {
        "issue": "Keeping the CVC until settlement or for up to 72 hours, including for incremental authorizations, conflicts with the PCI DSS v4.x ban on storing SAD after authorization (Req 3.3.1). The design misreads 3.2.1/3.3.2.",
        "location": "p.10 §12.4; p.3 NFR-6; p.18 §24",
        "covered_by_review": "partial"
      },
      {
        "issue": "Zero-RPO NFR-4 is impossible with asynchronous Aurora Global replication. The idempotency rebuild from the payment table is impossible because the table has no key column, and the 30-minute RTO exceeds the NFR-3 monthly budget.",
        "location": "p.3 NFR-4; p.16-17 §20.2; p.14-15 §19",
        "covered_by_review": "full"
      },
      {
        "issue": "The latency budget assumes fewer than 1% of payments cascade, but the baseline gives 3.8% retryable outcomes, and the 2,500 ms timeout alone exceeds the 1,500 ms NFR-2 limit.",
        "location": "p.17 §21.1; p.9 §10.5, §11.1; p.20 §26.2",
        "covered_by_review": "full"
      },
      {
        "issue": "Reconciliation waits for all files. ACQ-TH1 arrives at 06:30 ICT (07:30 SGT), and matching plus reporting adds 60 minutes, giving about 08:30 SGT and missing the NFR-8 08:00 deadline.",
        "location": "p.12-13 §16.1-16.2; p.3 NFR-8",
        "covered_by_review": "full"
      },
      {
        "issue": "A single CloudHSM in one AZ, with a 1,500 TPS trigger for adding a second that is never reached (55% of 2,000 = 1,100), is a single point of failure for card payments. The CDE also has no DR path.",
        "location": "p.10 §12.3; p.2 §1 volume table; p.16 §20",
        "covered_by_review": "full"
      },
      {
        "issue": "The DynamoDB per-partition limit is misstated (AWS documents 1,000 WCU/s, not 10,000), and the WCU calculation ignores item size and LSI writes. The largest merchant's single partition key will throttle.",
        "location": "p.8 §9.3",
        "covered_by_review": "partial"
      }
    ],
    "sound_areas": [
      {
        "area": "Double-entry ledger committed in the same transaction with an outbox, append-only enforced by revoked DML, nightly recomputation, and balanced examples",
        "location": "p.11-12 §14; p.16 §19"
      },
      {
        "area": "Integer minor-unit money representation with an ISO 4217 exponent table and adapters that reject rounding",
        "location": "p.12 §15"
      },
      {
        "area": "Webhook signing, bounded retry schedule, per-endpoint isolation and SSRF protection",
        "location": "p.13 §17"
      }
    ]
  },
  "verdict_extracted": {
    "present": true,
    "text": "label not_fit, confidence 0.75: 'As written, the design is not fit to build. The core architecture is sound.' Gives a per-objective breakdown and a 'what_would_change_it' list.",
    "label": "not_fit",
    "consistent_with_findings": true
  },
  "dimensions": {
    "D1": {
      "score": 4,
      "justification": "The intent summary accurately covers purpose, scope, the volume targets, P1-P10, the key FRs and NFRs, and the constraints, all cited to p.1-3. A decision registry keeps approved decisions (§24), pending backlog items (§25) and constraints apart. Findings are judged against the design's own principles and NFRs, not generic practice. Self-acknowledged gaps are credited: FND-026 cites Backlog item 2 and adds that the §27 and §28 readiness tables are inconsistent with it. Every challenge to a confirmed decision is backed by the design's own text.",
      "review_quotes": [
        "MPOP is Serindit Pay's Merchant Payment Orchestration Platform... replaces five per-market integration stacks with one merchant API",
        "The backlog acknowledges the item; this finding points out that the readiness and phase tables do not reflect it.",
        "Principles take precedence: where a later section conflicts with a principle, the principle wins."
      ],
      "design_locations": [
        "p.1-2 §1",
        "p.3-4 §3",
        "p.18-19 §24",
        "p.19 §25",
        "p.20-21 §27"
      ]
    },
    "D2": {
      "score": 4,
      "justification": "The verdict is explicit (not_fit), with confidence 0.75 and a breakdown across 18 objectives, principles and NFRs, each tied to finding IDs. 'what_would_change_it' lists the concrete conditions, each linked to a finding, for moving to fit_with_conditions, and the evidence that would move it further toward not_fit. The verdict follows from 1 critical and 11 high findings and separates the document from the architecture ('reflects the document as it stands'). The empty 'conditions' array is a formatting gap only; the conditions are given in what_would_change_it.",
      "review_quotes": [
        "As written, the design is not fit to build. The core architecture is sound.",
        "The verdict would move to fit_with_conditions if a revised design did the following",
        "The verdict does not depend on any of these unverified findings."
      ],
      "design_locations": [
        "p.3 §2.2",
        "p.21 §27"
      ]
    },
    "D3": {
      "score": 4,
      "justification": "All six categories are covered with anchored, material items: strengths (FND-058, FND-014, sound areas), risks (FND-001, 046, 049, 048, 047, 018, 054), gaps (FND-030, FND-052, FND-057), ambiguity (FND-029), unresolved assumptions (FND-026, FND-043) and validation needs (FND-027, FND-034). Every issue in my pre-read is covered, two of them only partially because they are hedged (CVC/PCI, DynamoDB limits). The review also finds valid issues I had not listed: the go-live sequencing contradiction, duplicate authorizations from timeout cascades, payout-account takeover, and state-machine gaps. There is no padding.",
      "review_quotes": [
        "Redis idempotency fast path keyed without merchant or body hash",
        "Go-live comes before fraud scoring, PCI assessment and load/DR validation",
        "Cascading after a timeout or 5xx can leave duplicate live authorizations; late approvals are discarded"
      ],
      "design_locations": [
        "p.8 §9.2",
        "p.21 §28",
        "p.9 §11.2",
        "p.14 §18.4"
      ]
    },
    "D4": {
      "score": 3,
      "justification": "Every finding has page, section and verbatim quote anchors, and the harness verified all of them. The evidence register separates doc quotes from derived inferences. However, two material external claims have no source. The PCI DSS rule on CVC retention and the DynamoDB per-partition limit both rest on 'the reviewer's understanding'. Both are correct in substance and properly hedged, but neither cites an authoritative source. No hallucinations were found.",
      "review_quotes": [
        "As the reviewer understands PCI DSS, card verification codes may not be kept once authorization is complete",
        "The per-partition figure is far above the reviewer's understanding of DynamoDB's documented limit and must be checked."
      ],
      "design_locations": [
        "p.10 §12.4",
        "p.8 §9.3"
      ],
      "anchor_tension": "Location traceability is at level 4, but unsourced external claims on two material points rule out 4."
    },
    "D5": {
      "score": 4,
      "justification": "Every material recommendation states the issue, rationale, supporting evidence IDs, expected benefit, objective references, and a concrete verification step. The elements fit together and are specific and bounded. FND-001 gives the exact new key schema and tests. FND-047 splits definite from ambiguous outcomes and adds a simulator case with an approval at 2,600 ms. FND-018 offers three bounded options.",
      "review_quotes": [
        "change the Redis key to idem:resp:{merchant_id}:{idempotency_key}. Store request_hash with the cached response and compare it on every hit",
        "Pass if a reversal is sent for attempt 1 and exactly one authorization stays live at the simulator.",
        "cut the per-attempt timeout and set a total cascade deadline that fits within 1,500 ms"
      ],
      "design_locations": [
        "p.8 §9.2",
        "p.9 §11.2",
        "p.17 §21.1"
      ]
    },
    "D6": {
      "score": 3,
      "justification": "The review affirms the ledger, money representation, webhooks, back-office controls and Aurora capacity, with reasons. Each challenge to a confirmed decision (one HSM, MFA optional, batch reconciliation, go-live gate) cites the design's own evidence. FND-034 makes its schema change conditional on investigation. Severity is not always calibrated. FND-022 is rated high, but its REQUIRES_ACTION->FAILED claim is overstated, because REQUIRES_ACTION->AUTHORISING->FAILED is permitted. FND-046, which undermines PCI scope, is arguably understated at high.",
      "review_quotes": [
        "The design meets FR-10 and P5 through database-enforced mechanisms rather than convention... so no change is justified.",
        "The key or LSI change is conditional on the investigation showing that DynamoDB limits bind"
      ],
      "design_locations": [
        "p.11-12 §14",
        "p.6 §7.2",
        "p.18-19 §24"
      ],
      "anchor_tension": "Strong restraint overall, but one severity is inflated and one is understated, which fits anchor 3 better than 4."
    },